checkpoints/mobilenet_v2_kldivLoss_adam_lr_0.001_epoch_10_batch_32_extracted_model_training_history.json

{"train_loss": [0.5886863289025072, 0.5359475859340282, 0.5177651577641653, 0.5137730703137686, 0.5177752185619441, 0.5145465031187922, 0.5158428180180628, 0.5109135643543726, 0.507304334517559, 0.5154776258340117], "train_acc": [0.5777388597003308, 0.5993383926834014, 0.6048842187195953, 0.6078030745281183, 0.604397742751508, 0.6088733216579101, 0.6104300447557891, 0.6125705390153726, 0.6141272621132516, 0.6019653629110722], "val_loss": [0.422467137589065, 0.42314673080054704, 0.42893930961185855, 0.4186742536288755, 0.42178167336645755, 0.4431754097400472, 0.4479616067752764, 0.4167148387849563, 0.42772315443721726, 0.42294985828232673], "val_acc": [0.6373540856031128, 0.643579766536965, 0.6315175097276264, 0.6365758754863813, 0.6490272373540856, 0.6396887159533073, 0.6392996108949416, 0.6498054474708171, 0.6474708171206226, 0.6424124513618678]}

README.md

## 5. TRAINING: TARGET VS SURROGATE

Epoch [1/10]
        Train Loss: 0.5887 | Train Acc: 0.5777 || Val Loss: 0.4225 | Val Acc: 0.6374
        best_validation_loss: 0.422467137589065
        Model is saved as current_validation_loss < best_validation_loss

Epoch [2/10]
        Train Loss: 0.5359 | Train Acc: 0.5993 || Val Loss: 0.4231 | Val Acc: 0.6436
        Model is not saved as current_validation_loss > best_validation_loss

Epoch [3/10]
        Train Loss: 0.5178 | Train Acc: 0.6049 || Val Loss: 0.4289 | Val Acc: 0.6315
        Model is not saved as current_validation_loss > best_validation_loss

Epoch [4/10]
        Train Loss: 0.5138 | Train Acc: 0.6078 || Val Loss: 0.4187 | Val Acc: 0.6366
        best_validation_loss: 0.4186742536288755
        Model is saved as current_validation_loss < best_validation_loss

Epoch [5/10]
        Train Loss: 0.5178 | Train Acc: 0.6044 || Val Loss: 0.4218 | Val Acc: 0.6490
        Model is not saved as current_validation_loss > best_validation_loss

Epoch [6/10]
        Train Loss: 0.5145 | Train Acc: 0.6089 || Val Loss: 0.4432 | Val Acc: 0.6397
        Model is not saved as current_validation_loss > best_validation_loss

Epoch [7/10]
        Train Loss: 0.5158 | Train Acc: 0.6104 || Val Loss: 0.4480 | Val Acc: 0.6393
        Model is not saved as current_validation_loss > best_validation_loss

Epoch [8/10]
        Train Loss: 0.5109 | Train Acc: 0.6126 || Val Loss: 0.4167 | Val Acc: 0.6498
        best_validation_loss: 0.4167148387849563
        Model is saved as current_validation_loss < best_validation_loss

Epoch [9/10]
        Train Loss: 0.5073 | Train Acc: 0.6141 || Val Loss: 0.4277 | Val Acc: 0.6475
        Model is not saved as current_validation_loss > best_validation_loss

Epoch [10/10]
        Train Loss: 0.5155 | Train Acc: 0.6020 || Val Loss: 0.4229 | Val Acc: 0.6424
        Model is not saved as current_validation_loss > best_validation_loss